{"entities":[{"definition":null,"id":"e0","kind":"system","parent":null,"properties":[{"name":"root","value":"pipeline"}],"schema_ref":null,"scope":"main","source":{"end_column":16,"end_line":18,"file":"hierarchy.py","start_column":1,"start_line":16},"type":null,"uses":[]},{"definition":null,"id":"e1","kind":"module","parent":"e0","properties":[{"name":"name","value":"pipeline"}],"schema_ref":null,"scope":"pipeline","source":{"end_column":19,"end_line":13,"file":"hierarchy.py","start_column":1,"start_line":10},"type":null,"uses":[]},{"definition":null,"id":"e2","kind":"arg","parent":"e1","properties":[{"name":"name","value":"request"}],"schema_ref":null,"scope":"pipeline","source":{"end_column":19,"end_line":13,"file":"hierarchy.py","start_column":1,"start_line":10},"type":"Flow[int, ReadyValid]","uses":[]},{"definition":null,"id":"e3","kind":"call","parent":"e1","properties":[{"name":"instance_name","value":"refined"}],"schema_ref":{"identity":"test.Refine"},"scope":"pipeline","source":{"end_column":30,"end_line":12,"file":"hierarchy.py","start_column":15,"start_line":12},"type":null,"uses":["e2"]},{"definition":null,"id":"e4","kind":"result","parent":"e3","properties":[{"name":"name","value":"refined#0"}],"schema_ref":null,"scope":"pipeline","source":{"end_column":30,"end_line":12,"file":"hierarchy.py","start_column":15,"start_line":12},"type":"i32","uses":["e3"]},{"definition":null,"id":"e5","kind":"return","parent":"e1","properties":[],"schema_ref":null,"scope":"pipeline","source":{"end_column":19,"end_line":13,"file":"hierarchy.py","start_column":1,"start_line":10},"type":null,"uses":["e4"]}],"entry":"e0","schema":"agentic-circuit-acpy","sources":[{"path":"hierarchy.py"}],"version":"0.1"}
